path,name,metadata,description
raw/public/population/nectas.csv,NECTA County Subdivisions,nectas.md; NECTA_WallMap_Mar2020.pdf,County subdivisions classified by metropolitan and micropolitan
raw/public/population/nectas.xlsx,NECTA County Subdivisions,nectas.md; NECTA_WallMap_Mar2020.pdf,County subdivisions classified by metropolitan and micropolitan but saved as excel file to try to retain leading zeros
raw/public/population/tidycensus_population.gpkg, County Subdivisions Population Data geopackage, tidydecennialcensus_variables.csv; tidyacs_variables.csv; code for retrieval at procedure/code/00_population_data_tidycensus.Rmd, Total population and geographic data for mapping by county subdivision in VT; NH; NY; and MA in a geopackage file. Elderly population data for VT subdivisions. 
raw/public/population/tidycensus_population.csv, County Subdivisions Population Data csv, tidydecennialcensus_variables.csv; tidyacs_variables.csv; code for retrieval at procedure/code/00_population_data_tidycensus.Rmd, Same as above but different file format. 
raw/public/population/list3_2020.xls, NECTA county subdivisions raw, Same as for other NECTA data, Raw data from US Census Bureau on metropolitan/microplitan county subdivision classifications. Removed unnecessary columns and renamed variables then saved as nectas.csv
raw/public/pharmacy/instate_pharmacylist_vt.xlsx, Initial VT State Pharmacy List, VT_InState_Pharmacy_metadata.md, Contains initial list of VT retail pharmacies from VT Office of Professional Regulation
raw/public/pharmacy/pharmacies.gpkg, Final pharmacy data (without staffing levels), pharmacies_metadata.md, Final list of pharmacies in study area (VT; parts of NY; MA; NH) with coordinates; addresses; hours of operations. Data with staffing will be saved in private folder; accessible upon request from OSM private folder. 
raw/private/pharm_staffing.csv, Final pharmacy staffing data, pharm_staffing.md, List off pharmacies with staffing data and pharmacy id; will be joined to pharmacies.gpkg in analysis.
